{
	"$schema": "http://json-schema.org/draft-07/schema#",
	"title": "Narrative Wardrobe",
	"description": "The clothing for a Character in the narrative.",
	"type": "object",
	"required": [
		"entityType",
		"identifier"
	],
	"properties": {
		"entityInfo": {
			"title": "Entity Information",
			"$ref": "../Model/definitions.json#/properties/entityInfo"
		},
		"entityType": {
			"type": "string",
			"title": "Entity Type",
			"const": "NarrativeWardrobe"
		},
		"identifier": {
			"$ref": "../Utility/identifier.json"
		},
		"name": {
			"title": "Narrative Wardrobe Name",
			"description": "A human readable name for the narrative wardrobe",
			"type": [
				"string",
				"null"
			]
		},
		"description": {
			"title": "Narrative Wardrobe Description",
			"description": "A brief description of the narrative wardrobe",
			"type": [
				"string",
				"null"
			]
		},
		"customData": {
			"title": "Custom Data",
			"$ref": "../Model/definitions.json#/properties/customData"
		},
		"Context": {
			"title": "Narrative Wardrobe Context",
			"description": "Informs scope within the construction process of a Creative Work by describing related entities",
			"type": "object",
			"required": [
				"entityType",
				"identifier"
			],
			"properties": {
				"entityInfo": {
					"title": "Entity Information",
					"$ref": "../Model/definitions.json#/properties/entityInfo"
				},
				"entityType": {
					"type": "string",
					"title": "Entity Type",
					"const": "Context"
				},
				"identifier": {
					"$ref": "../Utility/identifier.json"
				},
				"isUsedIn": {
					"title": "isUsedIn",
					"type": "object",
					"properties": {
						"NarrativeScene": {
							"type": "array",
							"items": {
								"$ref": "../MediaCreationContext/NarrativeScene.json"
							}
						}
					}
				},
				"isWardrobeFor": {
					"title": "isWardrobeFor",
					"type": "object",
					"properties": {
						"Character": {
							"type": "array",
							"items": {
								"$ref": "../MediaCreationContext/Character.json"
							}
						}
					}
				}
			},
			"additionalProperties": true
		}
	},
	"additionalProperties": true
}