[
  {
    "entityType": "NarrativeWardrobe",
    "identifier": [
      {
        "identifierScope": "labkoat",
        "identifierValue": "wrd/Ia7-FdhY1yBFyqG_2nYW8"
      }
    ],
    "name": "Spacesuit",
    "description": "RD-12 Envrionmental Protection Suit",
    "Context": {
      "entityType": "Context",
      "identifier": [
        {
          "identifierScope": "labkoat",
          "identifierValue": "cxt/wWz2OqsKDO7bTLZm9TdTJ"
        }
      ],
      "isWardrobeFor": {
        "Character": [
          {
            "entityType": "Character",
            "identifier": [
              {
                "identifierScope": "labkoat",
                "identifierValue": "chr/HNvHjXqJY9wv1IwjG-Hf1"
              }
            ]
          }
        ]
      }
    }
  },
  {
    "entityType": "NarrativeWardrobe",
    "identifier": [
      {
        "identifierScope": "labkoat",
        "identifierValue": "wrd/Hex65mL3RTBcLiGmAVh8d"
      }
    ],
    "name": "Killamari exo-skeleton",
    "description": "The life long container of the dreaded Killamari.",
    "Context": {
      "entityType": "Context",
      "identifier": [
        {
          "identifierScope": "labkoat",
          "identifierValue": "cxt/CTkF7d29sRbVLTfYB6RhU"
        }
      ],
      "isWardrobeFor": {
        "Character": [
          {
            "entityType": "Character",
            "identifier": [
              {
                "identifierScope": "labkoat",
                "identifierValue": "chr/LC4nrtxXR3CVPDUr8DAOJ"
              }
            ]
          }
        ]
      }
    }
  }
]
